{
  "family": "tokens",
  "version": "1.0.0",
  "governing_fact": "Every Tesserine surface is a typeset record: the quiet, documentary projection of a machine-readable artifact that remains the product. (design/v1/SYSTEM.md)",
  "members": [
    {
      "id": "color.paper",
      "value": "#FAF9F5",
      "role": "the ground every surface sits on",
      "derivation": "Entailment 1 (a document's ground): a record is read like paper, so the ground is warm paper — not screen-white glare — and disappears under the record."
    },
    {
      "id": "color.ink",
      "value": "#1F1C17",
      "role": "text, by default",
      "derivation": "Entailment 1 (a document's ground): warm near-black ink on warm paper, the documentary pair; contrast far above sustained-reading need without the harshness of pure black on pure white."
    },
    {
      "id": "color.ink-muted",
      "value": "#635D52",
      "role": "secondary matter that recedes: metadata, captions, provenance",
      "derivation": "Entailment 1 (a document's ground): a record's secondary matter recedes without dropping legibility — one muted step of the same warm ink, still comfortably readable at caption size."
    },
    {
      "id": "color.rule",
      "value": "#D9D4C9",
      "role": "delineating rules",
      "derivation": "Entailment 2 (one rhythm, one ratio): structure is marked by the least sufficient rule, so the rule ink sits at the lowest contrast that still delineates — structure shown, never shouted."
    },
    {
      "id": "color.reference",
      "value": "#2D4A73",
      "role": "citations and links",
      "derivation": "Entailment 3 (ink speaks only for the record): a citation is the record speaking — the one non-state departure from ink, set in annotation blue-black like a ledger's cross-reference."
    },
    {
      "id": "color.state-ok",
      "value": "#2F6B4F",
      "role": "a state the record reports as passing or healthy",
      "derivation": "Entailment 3 (ink speaks only for the record): the record's own passing state, in a deep documentary green legible as text on the paper ground."
    },
    {
      "id": "color.state-attention",
      "value": "#8A5A00",
      "role": "a state the record reports as needing attention",
      "derivation": "Entailment 3 (ink speaks only for the record): the record's own needs-attention state, in a dark amber that stays legible as text rather than bright warning paint."
    },
    {
      "id": "color.state-failure",
      "value": "#9E2B25",
      "role": "a state the record reports as failing",
      "derivation": "Entailment 3 (ink speaks only for the record): the record's own failing state, in a deep red that reads as ink, not alarm decoration."
    },
    {
      "id": "space.quarter",
      "value": "0.375rem",
      "role": "space inside one line group",
      "derivation": "Entailment 2 (one rhythm, one ratio): a quarter of the reading line (1.5rem), the smallest named interval on the rhythm."
    },
    {
      "id": "space.half",
      "value": "0.75rem",
      "role": "space between grouped elements inside a form",
      "derivation": "Entailment 2 (one rhythm, one ratio): half of the reading line (1.5rem); grouping distance on the rhythm."
    },
    {
      "id": "space.line",
      "value": "1.5rem",
      "role": "space between blocks of running matter",
      "derivation": "Entailment 2 (one rhythm, one ratio): the reading line itself — the body step's 1rem at its 1.5 line height — the unit every other space is named from."
    },
    {
      "id": "space.double",
      "value": "3rem",
      "role": "space between sections",
      "derivation": "Entailment 2 (one rhythm, one ratio): two reading lines; a section boundary is a full breath on the same rhythm, not an arbitrary gap."
    },
    {
      "id": "stroke.hairline",
      "value": "1px",
      "role": "width of every delineating rule",
      "derivation": "Entailment 2 (one rhythm, one ratio): the least sufficient mark — the thinnest rule a screen draws — because a record delineates, it does not decorate."
    },
    {
      "id": "measure.reading",
      "value": "66ch",
      "role": "line length of the reading column",
      "derivation": "Entailment 1 (a document's ground): the book measure for sustained reading, ~66 characters — the record is read at length, so the column is set like a book's."
    },
    {
      "id": "weight.text",
      "value": "400",
      "role": "everything read in sequence",
      "derivation": "Entailment 2 (one rhythm, one ratio): running matter carries the reading weight; only structure departs from it."
    },
    {
      "id": "weight.structure",
      "value": "700",
      "role": "text that ranks the record: titles and headings",
      "derivation": "Entailment 2 (one rhythm, one ratio): structure is marked by weight rather than ornament — one bold step against the reading weight, nothing between."
    },
    {
      "id": "font.text",
      "value": "Georgia, 'Iowan Old Style', 'Times New Roman', serif",
      "role": "face for everything read as prose",
      "derivation": "Entailment 1 (a document's ground): a typeset record is set in a book serif, and in stock faces only — the projection renders without fetching a display face, so the ground stays quiet everywhere the record travels."
    },
    {
      "id": "font.machine",
      "value": "ui-monospace, 'Cascadia Code', Menlo, Consolas, monospace",
      "role": "face for verbatim machine matter",
      "derivation": "Entailment 3 (ink speaks only for the record): the record's verbatim matter stays visibly machine-shaped — a stock monospace, so what the machine said is never dressed as prose."
    }
  ]
}
